,2025,2024,2023,2022,2021,2020,2019,2018,2017,2016,2015
Operating activities,,,, , , ,,,,,
Income from continuing operations,"$ 1,587","$ 1,377","$ 1,262",1035,1441,1071,1269,1340,1390,565,1332
Adjustments to reconcile net income to cash from operations:,,,, , , ,,,,,
Depreciation and amortization,528,492,514,502,561,509,511,497,460,440,446
Pension settlement charge,0,0,190,0,50,,,,60,968,0
"Impairment and other-related charges, net",24,146,160,231,21,,,,,,
Stock-based compensation expense,46,42,56,34,57,44,39,37,35,45,54
Deferred income taxes,(27),(97),(187),-151,35,-47,-5,45,38,171,0
"Business restructuring, net",6,233,(2),33,,174,176,,0,191,
Cash contributions to pension plans,(29),(26),(46),-11,-10,-17,-13,-99,-87,-188,-263
Cash used for restructuring actions,(82),(52),(56),-85,-77,-126,-58,-66,,,
Change in certain asset and liability accounts (net of acquisitions):,,,, , , ,,,,,
Receivables,(190),(181),12,-248,-63,187,121,-69,-76,-68,-125
Inventories,(35),(27),145,-177,-279,111,145,-109,-116,56,37
Other current assets,(1),(30),(41),-59,32,49,-95,5,-43,21,-81
Accounts payable and accrued liabilities,67,(259),151,21,295,127,-63,-76,188,169,152
"Noncurrent assets and liabilities, net",(40),(73),(50),-112,-109,-25,-25,-207,-170,-53,79
Taxes and interest payable,(105),(31),71,143,-64,-108,-32,50,-129,-268,-96
Other,187,(123),115,-156,-195,88,-13,-20,14,-64,-19
Cash from operating activities - continuing operations,1936,1391,2294,1000,,,2084,1487,,,
Cash from operating activities - discontinued operations,5,29,117,,,,,,,,136
Cash from operating activities,1941,1420,2411,963,1562,2130,2080,1467,,,
Investing activities,,,, , , ,,,,,
Capital expenditures,(778),(721),(516),-486,-371,-304,-413,-411,,,
"Business acquisitions, net of cash balances acquired",(1),(31),(109),-114,-2137,-1169,-643,-378,,,
Proceeds from divestiture of businesses,43,325,36,117,,,,,,,
Cash used for investing activities - continuing operations,(700),(399),(525),-430,,,,,-63,,
Cash from/(used for) investing activities - discontinued operations,0,506,(31),-31,,,,,,,
Cash (used for)/from investing activities,(700),107,(556),,,,,,,436,-395
Financing activities,,,, , , ,,,,,
"Proceeds from Term Loan, net of fees",309,274,550,,,1497,,,,,
Repayment of Term Loan Credit Agreement,0,0,"(1,100)",-300,0,0,,,,,
"Proceeds from the issuance of debt, net of discounts and fees",1633,0,0,1116,692,415,595,992,,,
Repayment of long-term debt,"(1,039)",(300),(300),0,-847,-500,-637,-6,,,
Purchase of treasury stock,(790),(752),(86),-190,-210,0,-325,-1721,-813,-1050,-751
Dividends paid on PPG common stock,(628),(622),(598),-570,-536,-496,-468,-453,-434,-414,-383
Cash used for financing activities - continuing operations,(545),"(1,425)","(1,550)",-409,,,,,,,
Cash used for financing activities - discontinued operations,0,0,0,0,,,,,,,
Cash used for financing activities,(545),"(1,425)","(1,550)",-409,,,,-1205,-1954,-1210,-812
Effect of currency exchange rate changes on cash and cash equivalents,197,(325),110,1,-72,6,1,-32,69,-68,-63
Cash reclassified to assets held for sale,0,0,(5),-3,,-20,0,0,,,
Net increase/(decrease) in cash and cash equivalents,893,(223),410,,-821,610,,-534,-384,,
"Cash and cash equivalents, beginning of year",1270,1493,1083,992,1826,1216,902,1436,1820,1311,686
"Cash and cash equivalents, end of year",2163,1270,1493,1083,1005,1826,1216,902,1436,1820,1311
Supplemental disclosures of cash flow information:,,,, , , ,,,,,
"Interest paid, net of amount capitalized",210,247,213,156,140,153,127,108,100,118,115
"Taxes paid, net of refunds",438,653,488,436,491,367,348,380,648,349,383
Capital expenditures accrued within Accounts payable and accrued liabilities at year-end,147,160,170,71,163,37,53,,,,
Purchases of treasury stock transacted but not yet settled,$ 4,$ 12,$ 14,0,40,0,0,,,,
Cash from/(used for) operating activities - discontinued operations,,,,-37,,,-4,-20,,,
Cash from/(used for) investing activities,,,,-461,,,,,,,
"Proceeds from Term Loan Credit Agreement, net of fees",,,,0,1399,0,0,,,,
Net payments on commercial paper and short-term debt,,,,-439,,,,,,-361,-528
Net (decrease)/increase in cash and cash equivalents,,,,91,,,314,,,509,
Asbestos-related claims reserve adjustment,,,,,-133,0,12,,,,
Proceeds from asset sales,,,,,47,0,,,,,
Cash used for investing activities,,,,,-2404,-1447,-1009,-764,-67,,
Net (payments on)/proceeds from commercial paper and short-term debt,,,,,190,150,,,,,
Repayment of Term Loan,,,,,-400,-1100,0,0,,,
Repayment of acquired debt,,,,,-207,-13,-23,0,,,
Cash (used for)/from financing activities,,,,,93,-59,,,,,
"Impairment and other related charges, net",,,,,,93,,,,,
Proceeds from revolving credit facility,,,,,,800,0,0,,,
Repayment of revolving credit facility,,,,,,-800,0,0,,,
Net income attributable to the controlling and noncontrolling interests,,,,,,,1269,1358,1615,895,1427
"Income from discontinued operations, net of tax",,,,,,,0,18,225,330,95
Pension (income)/expense,,,,,,,54,,,,
Pension settlement charge and pension curtailment charge,,,,,,,0,,,,
Impairment charges,,,,,,,0,0,,,
"Environmental remediation charges and other costs, net",,,,,,,61,77,0,,
Gain from sale of production facility,,,,,,,0,,,,
Proceeds from sale of production facility,,,,,,,0,,,,
"Proceeds on commercial paper and short-term debt, net of payments",,,,,,,100,-2,,,
Payments related to tax withholding on stock-based compensation awards,,,,,,,-20,-15,-28,-26,-58
Issuance of treasury stock,,,,,,,61,15,52,31,53
Purchase of noncontrolling interest,,,,,,,-39,0,,,
Cash from/(used for) financing activities,,,,,,,-758,,,,
Reissuance of common stock for business acquisition,,,,,,,164,0,,,
Pension expense,,,,,,,,43,65,,
Pension curtailment charges,,,,,,,,0,,,
Gain (Loss) on Extinguishment of Debt,,,,,,,,0,,,
Business restructuring,,,,,,,,66,,,136
Gain on sale of land,,,,,,,,-26,0,0,
"Equity affiliate loss/(income), net of dividends",,,,,,,,-1,-4,,
Proceeds from sale of land,,,,,,,,27,0,,
Payments for the settlement of cross currency swap contracts,,,,,,,,-28,-34,-36,-34
Proceeds from the settlement of cross currency swap contracts,,,,,,,,23,37,37,37
Net change in borrowings with maturities of three months or less,,,,,,,,-1,-7,-15,-32
"Net gain, from sale of businesses",,,,,,,,,-25,-39,0
Restructuring cash expenditures,,,,,,,,,-49,-76,-47
Cash from operating activities - continuing operations,,,,,,,,,1551,1218,1759
Cash (used for)/from operating activities - discontinued operations,,,,,,,,,17,133,
Cash from operating activities,,,,,,,,,1568,1351,1895
Additions to property and investments,,,,,,,,,-360,-380,-430
"Business acquisitions, net of cash balances acquired (See Note 2)",,,,,,,,,-225,-349,-320
Payments for acquisition of equity investment,,,,,,,,,-100,0,0
Net proceeds from the sale of businesses,,,,,,,,,593,1094,47
Cash used for investing activities - discontinued operations,,,,,,,,,-4,-36,-46
Net proceeds/(payments) on commercial paper and short-term debt,,,,,,,,,-93,,
Proceeds from long term debt (net of discount and issuance costs) (See Note 8),,,,,,,,,0,988,1242
Repayment of long-term debt (See Note 8),,,,,,,,,-588,-379,-340
Repayments of acquired debt,,,,,,,,,0,,
Payments to noncontrolling interests,,,,,,,,,0,,
"Noncash or Part Noncash Acquisition, Noncash Financial or Equity Instrument Consideration, Shares Issued",,,,,,,,,0,,
Adjustments to reconcile to cash from operations:,,,,,,,,,,,
Defined benefit pension expense,,,,,,,,,,85,88
Environmental remediation charges and other costs,,,,,,,,,,82,
Proceeds from Sale of Land Held-for-use,,,,,,,,,,0,
"Equity affiliate (income)/loss, net of dividends",,,,,,,,,,-6,66
Funding of asbestos settlement trust,,,,,,,,,,-813,0
Proceeds from maturity of short-term investments,,,,,,,,,,92,402
Payments on net investment hedges,,,,,,,,,,-13,
Cash (used for)/from investing activities - continuing operations,,,,,,,,,,472,-349
Environmental remediation charge,,,,,,,,,,,0
Purchase of short-term investments,,,,,,,,,,,-97
(Payments on) / Proceeds from net investment hedges,,,,,,,,,,,19
Net (decrease) increase in cash and cash equivalents,,,,,,,,,,,625
